{"scrollPos":0,"selectedCell":1,"cursorPos":0,"cells":[{"inputBuffer":"(cd tests && TZ=GMT0 ../tcpdump -# -n -r icmp-ext-ipv6.pcap )","outputBuffer":"reading from file icmp-ext-ipv6.pcap, link-type EN10MB (Ethernet), snapshot length 262144\n    1  06:54:11.698402 IP6 fe80::1c7c:caa:f732:f468 > fe80::5: ICMP6, extended echo (PROBE) request, length 8\n\t0x0000:  a100 e7c5 00c8 6466\n    2  06:54:11.698415 IP6 fe80::1c7c:caa:f732:f468 > fe80::5: ICMP6, extended echo (PROBE) reply, No error, length 20\n    3  06:54:11.698418 IP6 fe80::1c7c:caa:f732:f468 > fe80::5: ICMP6, extended echo (PROBE) reply, No error, length 24\n    4  06:54:11.698426 IP6 fe80::1c7c:caa:f732:f468 > fe80::5: ICMP6, extended echo (PROBE) reply, No error, length 24\n","workingDirectory":"/Users/ishaangandhi/Develop/tcpdump","executionState":1,"hasError":true,"uuid":"732cc614-2ce4-4099-8a2b-ce4fd5432502"},{"inputBuffer":"(cd tests && TZ=GMT0 ../tcpdump -# -n -r icmp-ext-ipv4.pcap )","outputBuffer":"reading from file icmp-ext-ipv4.pcap, link-type EN10MB (Ethernet), snapshot length 262144\n    1  20:42:53.959853 IP 192.168.0.35 > 10.10.10.10: ICMP PROBE reply, id 200, seq 25702, length 8\n    2  20:42:53.959854 IP 192.168.0.35 > 10.10.10.10: ICMP PROBE request, length 20\n    3  20:42:53.959871 IP 192.168.0.35 > 10.10.10.10: ICMP PROBE request, length 24\n    4  20:42:53.959892 IP 192.168.0.35 > 10.10.10.10: ICMP PROBE request, length 24\n","workingDirectory":"/Users/ishaangandhi/Develop/tcpdump","executionState":1,"hasError":true,"uuid":"7bbe6a52-0962-491a-abc3-f5da555c75ac"},{"inputBuffer":"make","outputBuffer":"gcc -W -Wall -Wassign-enum -Wcast-qual -Wmissing-prototypes -Wmissing-variable-declarations -Wold-style-definition -Wpedantic -Wpointer-arith -Wpointer-sign -Wshadow -Wsign-compare -Wstrict-prototypes -Wunreachable-code-return -Wused-but-marked-unused -Wwrite-strings -DHAVE_CONFIG_H   -I. -I/usr/local/include  -g -O2 -c ./print-icmp6.c\n./print-icmp6.c:742:25: warning: unused variable 'icmp6_ext_echo_reply_state_str' [-Wunused-const-variable]\nstatic const struct tok icmp6_ext_echo_reply_state_str[] = {\n                        ^\n1 warning generated.\nar cr libnetdissect.a addrtoname.o addrtostr.o af.o ascii_strcasecmp.o checksum.o cpack.o gmpls.o in_cksum.o ipproto.o l2vpn.o machdep.o netdissect.o netdissect-alloc.o nlpid.o ntp.o oui.o parsenfsfh.o print.o print-802_11.o print-802_15_4.o print-ah.o print-ahcp.o print-aodv.o print-aoe.o print-ap1394.o print-arcnet.o print-arista.o print-arp.o print-ascii.o print-atalk.o print-atm.o print-babel.o print-bcm-li.o print-beep.o print-bfd.o print-bgp.o print-bootp.o print-brcmtag.o print-bt.o print-calm-fast.o print-carp.o print-cdp.o print-cfm.o print-chdlc.o print-cip.o print-cnfp.o print-dccp.o print-decnet.o print-dhcp6.o print-domain.o print-dsa.o print-dtp.o print-dvmrp.o print-eap.o print-egp.o print-eigrp.o print-enc.o print-esp.o print-ether.o print-fddi.o print-forces.o print-fr.o print-frag6.o print-ftp.o print-geneve.o print-geonet.o print-gre.o print-hncp.o print-hsrp.o print-http.o print-icmp.o print-icmp6.o print-igmp.o print-igrp.o print-ip-demux.o print-ip.o print-ip6.o print-ip6opts.o print-ipcomp.o print-ipfc.o print-ipnet.o print-ipoib.o print-ipx.o print-isakmp.o print-isoclns.o print-juniper.o print-krb.o print-l2tp.o print-lane.o print-ldp.o print-lisp.o print-llc.o print-lldp.o print-lmp.o print-loopback.o print-lspping.o print-lwapp.o print-lwres.o print-m3ua.o print-macsec.o print-mobile.o print-mobility.o print-mpcp.o print-mpls.o print-mptcp.o print-msdp.o print-msnlb.o print-nflog.o print-nfs.o print-nsh.o print-ntp.o print-null.o print-olsr.o print-openflow-1.0.o print-openflow.o print-ospf.o print-ospf6.o print-otv.o print-pgm.o print-pim.o print-pktap.o print-ppi.o print-ppp.o print-pppoe.o print-pptp.o print-ptp.o print-radius.o print-raw.o print-resp.o print-rip.o print-ripng.o print-rpki-rtr.o print-rrcp.o print-rsvp.o print-rt6.o print-rtsp.o print-rx.o print-sctp.o print-sflow.o print-sip.o print-sl.o print-sll.o print-slow.o print-smtp.o print-snmp.o print-someip.o print-ssh.o print-stp.o print-sunatm.o print-sunrpc.o print-symantec.o print-syslog.o print-tcp.o print-telnet.o print-tftp.o print-timed.o print-tipc.o print-token.o print-udld.o print-udp.o print-unsupported.o print-usb.o print-vjc.o print-vqp.o print-vrrp.o print-vsock.o print-vtp.o print-vxlan-gpe.o print-vxlan.o print-wb.o print-zep.o print-zephyr.o print-zeromq.o signature.o strtoaddr.o util-print.o print-smb.o smbutil.o \nranlib libnetdissect.a\ngcc -W -Wall -Wassign-enum -Wcast-qual -Wmissing-prototypes -Wmissing-variable-declarations -Wold-style-definition -Wpedantic -Wpointer-arith -Wpointer-sign -Wshadow -Wsign-compare -Wstrict-prototypes -Wunreachable-code-return -Wused-but-marked-unused -Wwrite-strings -DHAVE_CONFIG_H   -I. -I/usr/local/include  -g -O2  -o tcpdump fptype.o tcpdump.o  libnetdissect.a -L/usr/local/lib  -lpcap \n","workingDirectory":"/Users/ishaangandhi/Develop/tcpdump","executionState":1,"hasError":true,"uuid":"adc26aff-c363-4d10-bc3a-486c5680a5ca"},{"inputBuffer":"","outputBuffer":"","workingDirectory":"/Users/ishaangandhi/Develop/tcpdump","executionState":2,"hasError":false,"uuid":"e953d940-6432-4876-b2f5-45dcf7bbb7e7"}],"filename":"/Users/ishaangandhi/Develop/tcpdump/dev.ish","remote":"","uuid":"5af07d1b-e244-4104-9efc-c8f2a52b6a6e","dirty":false}